{
  "$schema": "https://json-schema.org/draft/2020-12/schema",
  "type": "object",
  "properties": {
    "schemaVersion": {
      "const": "1.0"
    },
    "name": {
      "type": "string"
    },
    "description": {
      "type": "string"
    },
    "base": {
      "type": "object",
      "properties": {
        "low": {
          "type": "number",
          "minimum": 0
        },
        "high": {
          "type": "number",
          "minimum": 0
        }
      },
      "required": [
        "low",
        "high"
      ],
      "additionalProperties": false
    },
    "factors": {
      "type": "object",
      "properties": {
        "routinePackageUpdate": {
          "type": "object",
          "properties": {
            "low": {
              "type": "number",
              "minimum": 0
            },
            "high": {
              "type": "number",
              "minimum": 0
            },
            "label": {
              "type": "string"
            }
          },
          "required": [
            "low",
            "high"
          ],
          "additionalProperties": false
        },
        "reviewedPatch": {
          "type": "object",
          "properties": {
            "low": {
              "type": "number",
              "minimum": 0
            },
            "high": {
              "type": "number",
              "minimum": 0
            },
            "label": {
              "type": "string"
            }
          },
          "required": [
            "low",
            "high"
          ],
          "additionalProperties": false
        },
        "manualOrAiRemediation": {
          "type": "object",
          "properties": {
            "low": {
              "type": "number",
              "minimum": 0
            },
            "high": {
              "type": "number",
              "minimum": 0
            },
            "label": {
              "type": "string"
            }
          },
          "required": [
            "low",
            "high"
          ],
          "additionalProperties": false
        },
        "removalPlan": {
          "type": "object",
          "properties": {
            "low": {
              "type": "number",
              "minimum": 0
            },
            "high": {
              "type": "number",
              "minimum": 0
            },
            "label": {
              "type": "string"
            }
          },
          "required": [
            "low",
            "high"
          ],
          "additionalProperties": false
        }
      },
      "additionalProperties": {
        "type": "object",
        "properties": {
          "low": {
            "type": "number",
            "minimum": 0
          },
          "high": {
            "type": "number",
            "minimum": 0
          },
          "label": {
            "type": "string"
          }
        },
        "required": [
          "low",
          "high"
        ]
      }
    },
    "adjustments": {
      "type": "object",
      "properties": {
        "solverUnresolved": {
          "type": "object",
          "properties": {
            "low": {
              "type": "number",
              "minimum": 0
            },
            "high": {
              "type": "number",
              "minimum": 0
            },
            "description": {
              "type": "string"
            }
          },
          "required": [
            "low",
            "high"
          ],
          "additionalProperties": false
        },
        "baselineFailed": {
          "type": "object",
          "properties": {
            "low": {
              "type": "number",
              "minimum": 0
            },
            "high": {
              "type": "number",
              "minimum": 0
            },
            "description": {
              "type": "string"
            }
          },
          "required": [
            "low",
            "high"
          ],
          "additionalProperties": false
        }
      },
      "additionalProperties": {
        "type": "object",
        "properties": {
          "low": {
            "type": "number",
            "minimum": 0
          },
          "high": {
            "type": "number",
            "minimum": 0
          },
          "description": {
            "type": "string"
          }
        },
        "required": [
          "low",
          "high"
        ]
      }
    },
    "assumptions": {
      "type": "array",
      "items": {
        "type": "string"
      }
    }
  },
  "required": [
    "schemaVersion",
    "base",
    "factors",
    "adjustments"
  ],
  "additionalProperties": false
}
